[
    {
        "record_type":  "adverse_action_reason_output",
        "reason_output_id":  "rso-0001-1",
        "decision_id":  "dec-0001",
        "version_id":  "ver-2026-07-adverse-action",
        "reason_code":  "RC-101",
        "driver_or_signal":  "cash_flow_stability",
        "reason_rank":  1,
        "mapping_version":  "mapver-2026-07",
        "mapping_id":  "map-101",
        "mapping_effective_date":  "2026-07-01",
        "disclosed_reason_text":  "Insufficient cash flow stability",
        "notice_template_id":  "aat-small-business-reason",
        "notice_template_version":  "tplver-2026-07",
        "selection_method_id":  "ranked-adverse-contribution",
        "selection_method_version":  "selver-2026-08",
        "decision_component":  "scoring",
        "source_driver_rank":  1,
        "policy_version":  "polver-2026-08"
    },
    {
        "record_type":  "adverse_action_reason_output",
        "reason_output_id":  "rso-0002-1",
        "decision_id":  "dec-0002",
        "version_id":  "ver-2026-07-adverse-action",
        "reason_code":  "RC-101",
        "driver_or_signal":  "cash_flow_stability",
        "reason_rank":  1,
        "mapping_version":  "mapver-2026-07",
        "mapping_id":  "map-101",
        "mapping_effective_date":  "2026-07-01",
        "disclosed_reason_text":  "Insufficient cash flow stability",
        "notice_template_id":  "aat-small-business-reason",
        "notice_template_version":  "tplver-2026-07",
        "selection_method_id":  "ranked-adverse-contribution",
        "selection_method_version":  "selver-2026-08",
        "decision_component":  "scoring",
        "source_driver_rank":  1,
        "policy_version":  "polver-2026-08"
    },
    {
        "record_type":  "adverse_action_reason_output",
        "reason_output_id":  "rso-0002-2",
        "decision_id":  "dec-0002",
        "version_id":  "ver-2026-07-adverse-action",
        "reason_code":  "RC-102",
        "driver_or_signal":  "debt_service_coverage",
        "reason_rank":  2,
        "mapping_version":  "mapver-2026-07",
        "mapping_id":  "map-102",
        "mapping_effective_date":  "2026-07-01",
        "disclosed_reason_text":  "Cash flow stability below policy range",
        "notice_template_id":  "aat-small-business-reason",
        "notice_template_version":  "tplver-2026-07",
        "selection_method_id":  "ranked-adverse-contribution",
        "selection_method_version":  "selver-2026-08",
        "decision_component":  "scoring",
        "source_driver_rank":  2,
        "policy_version":  "polver-2026-08"
    },
    {
        "record_type":  "adverse_action_reason_output",
        "reason_output_id":  "rso-0004-1",
        "decision_id":  "dec-0004",
        "version_id":  "ver-2026-07-adverse-action",
        "reason_code":  "RC-999",
        "driver_or_signal":  "revenue_volatility",
        "reason_rank":  1,
        "mapping_version":  "mapver-2026-07",
        "mapping_id":  "map-103",
        "mapping_effective_date":  "2026-07-01",
        "disclosed_reason_text":  "Revenue volatility above policy range",
        "notice_template_id":  "aat-small-business-reason",
        "notice_template_version":  "tplver-2026-07",
        "selection_method_id":  "ranked-adverse-contribution",
        "selection_method_version":  "selver-2026-08",
        "decision_component":  "scoring",
        "source_driver_rank":  1,
        "policy_version":  "polver-2026-06"
    },
    {
        "record_type":  "adverse_action_reason_output",
        "reason_output_id":  "rso-0005-1",
        "decision_id":  "dec-0005",
        "version_id":  "ver-2026-07-adverse-action",
        "reason_code":  "RC-104",
        "driver_or_signal":  "thin_file_or_missing_information",
        "reason_rank":  1,
        "mapping_version":  "mapver-2026-07",
        "mapping_id":  "map-104",
        "mapping_effective_date":  "2026-07-01",
        "disclosed_reason_text":  "Other",
        "notice_template_id":  "aat-small-business-reason",
        "notice_template_version":  "tplver-2026-07",
        "selection_method_id":  "ranked-adverse-contribution",
        "selection_method_version":  "selver-2026-08",
        "decision_component":  "scoring",
        "source_driver_rank":  1,
        "policy_version":  "polver-2026-08"
    },
    {
        "record_type":  "adverse_action_reason_output",
        "reason_output_id":  "rso-0006-1",
        "decision_id":  "dec-0006",
        "version_id":  "ver-2026-07-adverse-action",
        "reason_code":  "RC-105",
        "driver_or_signal":  "cash_flow_stability",
        "reason_rank":  1,
        "mapping_version":  "mapver-2026-07",
        "mapping_id":  "map-105",
        "mapping_effective_date":  "2026-07-01",
        "disclosed_reason_text":  "Industry concentration above policy range",
        "notice_template_id":  "aat-small-business-reason",
        "notice_template_version":  "tplver-2026-07",
        "selection_method_id":  "automatic-decline-driver",
        "selection_method_version":  "selver-2026-08",
        "decision_component":  "automatic_denial",
        "source_driver_rank":  2,
        "policy_version":  "polver-2026-08"
    },
    {
        "record_type":  "adverse_action_reason_output",
        "reason_output_id":  "rso-0007-1",
        "decision_id":  "dec-0007",
        "version_id":  "ver-2026-07-adverse-action",
        "reason_code":  "RC-106",
        "driver_or_signal":  "time_in_business",
        "reason_rank":  1,
        "mapping_version":  "mapver-2026-06",
        "mapping_id":  "map-106",
        "mapping_effective_date":  "2026-06-01",
        "disclosed_reason_text":  "Time in business below policy minimum",
        "notice_template_id":  "aat-small-business-reason",
        "notice_template_version":  "tplver-2026-07",
        "selection_method_id":  "ranked-adverse-contribution",
        "selection_method_version":  "selver-2026-08",
        "decision_component":  "scoring",
        "source_driver_rank":  1,
        "policy_version":  "polver-2026-08"
    },
    {
        "record_type":  "adverse_action_reason_output",
        "reason_output_id":  "rso-0008-1",
        "decision_id":  "dec-0008",
        "version_id":  "ver-2026-07-adverse-action",
        "reason_code":  "RC-101",
        "driver_or_signal":  "cash_flow_stability",
        "reason_rank":  1,
        "mapping_version":  "mapver-2026-07",
        "mapping_id":  "map-101",
        "mapping_effective_date":  "2026-07-01",
        "disclosed_reason_text":  "Insufficient cash flow stability",
        "notice_template_id":  "aat-small-business-reason",
        "notice_template_version":  "tplver-2026-07",
        "selection_method_id":  "ranked-adverse-contribution",
        "selection_method_version":  "selver-2026-08",
        "decision_component":  "scoring",
        "source_driver_rank":  1,
        "policy_version":  "polver-2026-08"
    },
    {
        "record_type":  "adverse_action_reason_output",
        "reason_output_id":  "rso-0008-2",
        "decision_id":  "dec-0008",
        "version_id":  "ver-2026-07-adverse-action",
        "reason_code":  "RC-102",
        "driver_or_signal":  "debt_service_coverage",
        "reason_rank":  2,
        "mapping_version":  "mapver-2026-07",
        "mapping_id":  "map-102",
        "mapping_effective_date":  "2026-07-01",
        "disclosed_reason_text":  "Debt service coverage below policy range",
        "notice_template_id":  "aat-small-business-reason",
        "notice_template_version":  "tplver-2026-07",
        "selection_method_id":  "ranked-adverse-contribution",
        "selection_method_version":  "selver-2026-08",
        "decision_component":  "scoring",
        "source_driver_rank":  3,
        "policy_version":  "polver-2026-08"
    },
    {
        "record_type":  "adverse_action_reason_output",
        "reason_output_id":  "rso-0008-3",
        "decision_id":  "dec-0008",
        "version_id":  "ver-2026-07-adverse-action",
        "reason_code":  "RC-103",
        "driver_or_signal":  "revenue_volatility",
        "reason_rank":  3,
        "mapping_version":  "mapver-2026-07",
        "mapping_id":  "map-103",
        "mapping_effective_date":  "2026-07-01",
        "disclosed_reason_text":  "Revenue volatility above policy range",
        "notice_template_id":  "aat-small-business-reason",
        "notice_template_version":  "tplver-2026-06",
        "selection_method_id":  "ranked-adverse-contribution",
        "selection_method_version":  "selver-2026-08",
        "decision_component":  "scoring",
        "source_driver_rank":  3,
        "policy_version":  "polver-2026-08"
    },
    {
        "record_type":  "adverse_action_reason_output",
        "reason_output_id":  "rso-0008-4",
        "decision_id":  "dec-0008",
        "version_id":  "ver-2026-07-adverse-action",
        "reason_code":  "RC-105",
        "driver_or_signal":  "industry_concentration",
        "reason_rank":  4,
        "mapping_version":  "mapver-2026-07",
        "mapping_id":  "map-105",
        "mapping_effective_date":  "2026-07-01",
        "disclosed_reason_text":  "Industry concentration above policy range",
        "notice_template_id":  "aat-small-business-reason",
        "notice_template_version":  "tplver-2026-07",
        "selection_method_id":  "ranked-adverse-contribution",
        "selection_method_version":  "selver-2026-08",
        "decision_component":  "scoring",
        "source_driver_rank":  4,
        "policy_version":  "polver-2026-08"
    },
    {
        "record_type":  "adverse_action_reason_output",
        "reason_output_id":  "rso-0008-5",
        "decision_id":  "dec-0008",
        "version_id":  "ver-2026-07-adverse-action",
        "reason_code":  "RC-108",
        "driver_or_signal":  "bank_balance_trend",
        "reason_rank":  5,
        "mapping_version":  "mapver-2026-07",
        "mapping_id":  "map-108",
        "mapping_effective_date":  "2026-07-01",